source,path,role
equity_lab,C:\Users\Asus\Documents\Datos_papers_PART-II\28_Equity Lab\output_country_year\equitylab_master_country_year.csv,"poverty, labor informality, gender labor indicators"
ilostat,C:\Users\Asus\Documents\Datos_papers_PART-II\33_ILOSTAT\output_country_year\ilostat_panel_country_year_wide.csv,labor market and informality indicators
wdi,C:\Users\Asus\Documents\Datos_papers_PART-II\20_WDI\output_country_year\wdi_wide_country_year.csv,poverty benchmarks and macro controls
wdi_gdp_pop,C:\Users\Asus\Documents\Datos_papers_PART-II\56_WDI_gdp\output_country_year\wdi_gdp_population_country_year.csv,GDP per capita and population controls
aspire,D:\Papers Desarrollo_2026\Datos_papers_PART-I\1_WB - ASPIRE\output_country_year\aspire_wide_country_year.csv,"social protection coverage, adequacy, and benefit incidence"
wb_gini,D:\Papers Desarrollo_2026\Datos_papers_PART-I\11_WB - GINI\output_country_year\panel_country_year_gini.csv,Gini coefficient
cepal,C:\Users\Asus\Documents\Datos_papers_PART-II\24_CEPAL\output_country_year\cepal_master_country_year.csv,"social, education, health, and total government expenditure"
sedlac,C:\Users\Asus\Documents\Datos_papers_PART-II\34_SEDLAC\output_country_year\sedlac_master_country_year.csv,income distribution extension and poverty-source audit
